{
  "catalogue_version": "1.0.0",
  "catalogue_id": "ice40ultra-to-generic-fpga",
  "revision": "2026-09-08.1",
  "title": "ICE40ULTRA primitives against a generic SRAM-FPGA capability profile",
  "description": "A worked example of the target-catalogue format, written against the ICE40ULTRA gate library that ships in plugins/gate_libraries/definitions. The target is a deliberately GENERIC capability profile (6-input LUTs, dual-port block RAM, DSP blocks, I/O buffers, global clock buffers) and not a specific device: every statement about the target is a profile assumption, and a real migration must replace this file with a device-specific catalogue reviewed against the target vendor's documentation.",
  "review": {
    "reviewed_by": "FPGAPA HAL fork maintainers",
    "reviewed_at": "2026-09-08",
    "method": "Manual review of every cell in plugins/gate_libraries/definitions/ice40ultra.hgl (cell properties, pin types and ff_config/lut_config) against a generic SRAM-FPGA capability profile. Source-side statements are taken from the gate library itself; target-side statements are profile assumptions.",
    "sources": [
      {
        "title": "plugins/gate_libraries/definitions/ice40ultra.hgl",
        "note": "the HAL gate library this catalogue's source_type names come from; the only source of primitive semantics used here"
      }
    ],
    "limitations": [
      "No vendor datasheet, device model or toolchain was consulted for either side; nothing in this catalogue is a vendor statement.",
      "The target is a capability profile, not a device: it has no resource counts, no speed grade and no I/O bank rules, so resource fit and timing cannot be assessed against it at all.",
      "The negative-edge flip-flop family (SB_DFFN, SB_DFFNE, SB_DFFNR, SB_DFFNS, SB_DFFNSR, SB_DFFNSS, SB_DFFNER, SB_DFFNES, SB_DFFNESR, SB_DFFNESS) is deliberately NOT covered in this revision: falling-edge capture interacts with the target's clocking rules and was not reviewed. Designs using it are reported as unresolved, which is the intended outcome, not an oversight.",
      "SB_LFOSC, SB_HFOSC, SB_I2C and SB_SPI are hard IP with no generic equivalent and are unresolved by construction."
    ]
  },
  "source": {
    "vendor": "Lattice",
    "family": "iCE40 UltraPlus",
    "gate_library": "ICE40ULTRA",
    "note": "source semantics are read from the HAL gate library, never from the primitive names"
  },
  "target": {
    "vendor": "generic",
    "family": "generic SRAM FPGA capability profile",
    "toolchain": {
      "name": "generic-fpga-flow",
      "version": "profile-2026.1",
      "note": "a placeholder identifying the profile revision; replace with the real toolchain name and version in a device-specific catalogue"
    },
    "note": "6-input LUTs with configurable INIT, flip-flops with clock enable and one asynchronous or synchronous reset, dual-port block RAM, DSP/MAC blocks, general purpose I/O buffers and global clock buffers. No hard I2C/SPI, no on-chip oscillator, no PLL is assumed."
  },
  "capabilities": [
    {
      "id": "lut6",
      "kind": "logic",
      "description": "6-input look-up table with a configurable INIT truth table."
    },
    {
      "id": "ff",
      "kind": "register",
      "description": "Rising-edge D flip-flop with optional clock enable and one reset or set input, synchronous or asynchronous."
    },
    {
      "id": "bram",
      "kind": "memory",
      "description": "Configurable dual-port block RAM with per-port clock, enable and write enable."
    },
    {
      "id": "dsp",
      "kind": "arithmetic",
      "description": "Multiply-accumulate block with optional input, pipeline and output registers."
    },
    {
      "id": "carry",
      "kind": "arithmetic",
      "description": "Dedicated carry logic inside the logic element."
    },
    {
      "id": "io",
      "kind": "io",
      "description": "General purpose I/O buffer with optional input and output registers."
    },
    {
      "id": "clock_buffer",
      "kind": "clocking",
      "description": "Global clock buffer driving a low-skew clock network."
    },
    {
      "id": "constant",
      "kind": "constant",
      "description": "Constant 0/1 sources, usually absorbed by the target synthesis flow."
    }
  ],
  "obligation_templates": [
    {
      "id": "semantic/lut4-into-lut6-init-order",
      "kind": "semantic",
      "title": "LUT INIT width and bit order",
      "description": "The ICE40ULTRA gate library declares LUT_INIT with descending bit order for SB_LUT4. A 6-input target LUT holds a wider INIT and may number its bits the other way round, so a copied INIT value is a different function.",
      "check": "Re-derive the target INIT from the source truth table (extend the 16-bit function to the target width and apply the target's bit order), then compare the two truth tables exhaustively - 64 input combinations is a complete check.",
      "severity": "high",
      "target_assumption": "the target LUT is a strict superset of a 4-input LUT and its INIT encoding is documented"
    }
  ],
  "mappings": [
    {
      "source_type": "SB_LUT4",
      "category": "supported",
      "target_capability": "lut6",
      "target_primitive": "LUT6",
      "rationale": "A 4-input LUT is a subset of a 6-input LUT; the gate library marks SB_LUT4 as c_lut with a LUT_INIT attribute, so the function is fully described by its truth table and carries over.",
      "requires_metadata": ["lut_input_count"],
      "assumptions": [
        {
          "id": "target.lut6-superset",
          "description": "The target LUT has at least four inputs and an INIT-configurable truth table.",
          "kind": "library"
        }
      ],
      "obligations": [
        "semantic/combinational-equivalence",
        "semantic/lut4-into-lut6-init-order"
      ]
    },
    {
      "source_type": "SB_CARRY",
      "category": "candidate",
      "target_capability": "carry",
      "target_primitive": "CARRY",
      "rationale": "The target has dedicated carry logic, but carry primitives are placement-constrained and their carry-in/carry-out conventions differ. Re-inferring the arithmetic and letting the target flow implement it is normally preferable to a one-to-one mapping.",
      "requires_metadata": [],
      "assumptions": [
        {
          "id": "target.carry-chain",
          "description": "The target provides dedicated carry logic reachable from its synthesis flow.",
          "kind": "library"
        }
      ],
      "obligations": ["semantic/arithmetic-carry-chain"],
      "notes": [
        "the ICE40ULTRA library types SB_CARRY's pins as 'none', so the carry direction is not readable from the netlist"
      ]
    },
    {
      "source_type": "SB_DFF",
      "category": "supported",
      "target_capability": "ff",
      "target_primitive": "DFF",
      "rationale": "A plain rising-edge D flip-flop; the gate library gives next_state = D and clocked_on = C, both of which the target flip-flop provides.",
      "requires_metadata": ["clock_pins"],
      "assumptions": [
        {
          "id": "target.ff-rising-edge",
          "description": "The target flip-flop captures on the rising clock edge.",
          "kind": "library"
        }
      ],
      "obligations": [
        "semantic/register-clocking",
        "semantic/power-up-and-init-state"
      ]
    },
    {
      "source_type": "SB_DFFE",
      "category": "supported",
      "target_capability": "ff",
      "target_primitive": "DFF_CE",
      "rationale": "Clock enable is folded into the next-state function (E & D | !E & IQ) in the gate library, which is exactly the behaviour of a target flip-flop with clock enable.",
      "requires_metadata": ["clock_pins", "enable_pins"],
      "assumptions": [
        {
          "id": "target.ff-clock-enable",
          "description": "The target flip-flop has a clock enable that holds the state when deasserted.",
          "kind": "library"
        }
      ],
      "obligations": [
        "semantic/register-clocking",
        "semantic/power-up-and-init-state"
      ]
    },
    {
      "source_type": "SB_DFFR",
      "category": "candidate",
      "target_capability": "ff",
      "target_primitive": "DFF_ASYNC_RESET",
      "rationale": "The gate library models R with clear_on, i.e. as an asynchronous clear. The target flip-flop offers an asynchronous reset, but polarity, recovery/removal timing and whether the target flow prefers a synchronous reset are all open questions.",
      "requires_metadata": ["clock_pins", "reset_pins"],
      "assumptions": [
        {
          "id": "target.ff-async-reset",
          "description": "The target flip-flop provides an asynchronous reset with the same active level.",
          "kind": "library"
        }
      ],
      "obligations": [
        "semantic/register-clocking",
        "semantic/async-set-reset-priority",
        "semantic/power-up-and-init-state"
      ]
    },
    {
      "source_type": "SB_DFFS",
      "category": "candidate",
      "target_capability": "ff",
      "target_primitive": "DFF_ASYNC_SET",
      "rationale": "The gate library models S with preset_on, i.e. as an asynchronous preset. Many target families implement set by inverting a reset flip-flop, which changes the power-up state.",
      "requires_metadata": ["clock_pins", "set_pins"],
      "assumptions": [
        {
          "id": "target.ff-async-set",
          "description": "The target flip-flop provides an asynchronous set, or a reset flip-flop plus inversion that preserves the observable behaviour.",
          "kind": "library"
        }
      ],
      "obligations": [
        "semantic/register-clocking",
        "semantic/async-set-reset-priority",
        "semantic/power-up-and-init-state"
      ]
    },
    {
      "source_type": "SB_DFFSR",
      "category": "candidate",
      "target_capability": "ff",
      "target_primitive": "DFF_SYNC_RESET",